OriginalReferendumId,ReferendumTypeCode,PrimaryContactId,AgencyCode,AgencyName,VoteDate, Amount ,ReferendaContact,YesVotes,NoVotes,ReferendumStatusCode,IsCertificationReceived,IsDpiReviewed,BriefDescription,FullDescription,ModifiedDate
5836,Recurring Referendum,8358,3381,McFarland School District,"Tuesday, April 2, 2024"," $ 10,600,000.00 ",Jeff Mahoney,2005,2849,Failed,FALSE,FALSE,"5yr Recurring Referendum to exceed Revenue Cap for additional revenues to be used to maintain 4K-Grade 12 instruction.  $3,700,000 on a recurring basis, beginning with the 2024-2025 school year, $1,500,000 on a recurring basis, beginning with the 2025-2026 school year, $1,700,000 on a recurring basis, beginning with the 2026-2027 school year, $1,800,000 on a recurring basis, beginning with the 2027-2028 school year, and $1,900,000 on a recurring basis, beginning with the 2028-2029 school year","RESOLUTION AUTHORIZING THE DISTRICT BUDGET TO
EXCEED REVENUE LIMIT FOR RECURRING PURPOSES AND PROVIDING FOR A REFERENDUM ELECTION ON THE QUESTION OF WHETHER 
TO APPROVE THE RESOLUTION

WHEREAS, the School District of McFarland School Board, Dane County, Wisconsin, (the โDistrictโ), hereby adopts this resolution entitled: โResolution Authorizing The District Budget To Exceed Revenue Limit For Recurring Purposes And Providing For A Referendum Election On The Question Of Whether To Approve The Resolutionโ (the โRevenue Limit Resolutionโ) in order to authorize the District budget to exceed the revenue limit set forth in Wis. Stat. ยง 121.91, for recurring purposes by $3,700,000 beginning with the 2024-2025 school year, by $1,500,000 beginning with the 2025-2026 school year, by $1,700,000 beginning with the 2026-2027 school year, by $1,800,000 beginning with the 2027-2028 school year and by $1,900,000 beginning with the 2028-2029 school year; and
WHEREAS, the School Board deems it to be desirable and in the best interest of the District, in order to maintain programs for 4K-Grade 12 instruction, to direct the District Clerk to submit the Revenue Limit Resolution to the electors for approval or rejection at the regularly scheduled spring election to be held on April 2, 2024; and
WHEREAS, this Revenue Limit Resolution must be approved by the electors for the District to be authorized to include the additional revenue in the District budgets beginning with the 2024-2025 school year.
  NOW, THEREFORE, BE IT RESOLVED by the School District of McFarland School Board as follows:
1.	Board Resolution.  The School District of McFarland School Board supports inclusion in the final District budget the following revenues in excess of the revenue limit set forth in Wis. Stat. ยง 121.91: $3,700,000 on a recurring basis, beginning with the 2024-2025 school year, $1,500,000 on a recurring basis, beginning with the 2025-2026 school year, $1,700,000 on a recurring basis, beginning with the 2026-2027 school year, $1,800,000 on a recurring basis, beginning with the 2027-2028 school year, and $1,900,000 on a recurring basis, beginning with the 2028-2029 school year; such additional revenues to be used to maintain 4K-Grade 12 instruction.  
2.	Referendum Election Date.  The District Clerk is hereby directed to call a referendum election to be held in the District at the regularly scheduled spring election to be held on April 2, 2024, for the purpose of submitting to the qualified electors of the District the proposition of whether this Revenue Limit Resolution shall be approved or rejected.  Further, the District Clerk shall prepare the requisite notices and provide election officials with all necessary election supplies, including ballots, if and to the extent required by Wis. Stat. ยง 121.91(3)(c).  
3.	DPI Notice.  Pursuant to the provisions of Wis. Stat. ยง 121.91(3)(a), the District Clerk shall notify the Department of Public Instruction of the date of the referendum election and shall provide the Department with a copy of this Revenue Limit Resolution within 10 days after its adoption, and shall further certify the results of the referendum to the Department within 10 days following the election.
4.	Filing of Resolution.  The District Clerk is directed to file this Resolution, ballots, and any other necessary election supplies with the official or agency responsible for preparing the ballots for the election no later than 70 days prior to the election on April 2, 2024, as required by Wis. Stats. ยง ยง121.91(3)(c) and 8.37.  
Adopted and recorded December 18, 2023.",12/20/23 8:49
5844,Non-Recurring Referendum,470,3427,Mellen School District,"Tuesday, April 2, 2024"," $ 1,500,000.00 ",Rachele Watson,277,355,Failed,FALSE,FALSE,"3 year non-recurring operational referendum for $500,000 for each year ($500,000 in 2024-2025, $500,000 in 2025-2026 and $500,000 in 2026-2027), for a total of $1,500,000.00.","3 year non-recurring operational referendum for $500,000 for each year ($500,000 in 2024-2025, $500,000 in 2025-2026 and $500,000 in 2026-2027), for paying the ongoing operational expenses of the school district (Total of $1,500,000.00)",1/16/24 8:16
5819,Recurring Referendum,970,3444,Menomonie Area School District,"Tuesday, February 20, 2024"," $ 4,200,000.00 ",Leah Theder,1891,2768,Failed,FALSE,FALSE,"RESOLUTION AUTHORIZING THE SCHOOL DISTRICT BUDGET TO EXCEED REVENUE LIMIT 
BY $4,200,000 FOR RECURRING PURPOSES.","BE IT RESOLVED by the School Board of the School District of the Menomonie Area, Dunn and St. Croix Counties, Wisconsin that the revenues included in the School District budget be authorized to exceed the revenue limit specified in Section 121.91, Wisconsin Statutes, by $4,200,000 beginning with the 2024-2025 school year, for recurring purposes consisting of operational expenses.",12/12/23 11:46
5906,Non-Recurring Referendum,1030,3484,Mercer School District,"Tuesday, April 2, 2024"," $ 4,000,000.00 ",Tricia Thompson,455,286,Passed,FALSE,FALSE,"A nonrecurring levy in the amount of $800,000.00 per year beginning with the 2024-2025 school year through the 2028-2029 school year for nonrecurring purposes consisting of operational and maintenance expenses; which includes staffing costs, instructional materials, deferred maintenance, and facility upkeep.","NOW, THEREFORE, BE IT RESOLVED by the School Board for the School District of Mercer as follows:

Authorization to Exceed Revenue Limits. Subject to the electorateโs approval at a referendum as further set forth herein, the Board hereby authorizes the District to increase the revenues included in District budget in excess of the state revenue limit by $800,000.00 per year beginning with the 2024-2025 school year through the 2028-2029 school year for nonrecurring purposes consisting of operational and maintenance expenses; which includes staffing costs, instructional materials, deferred maintenance, and facility upkeep.
 
Filing of Resolution.  This Resolution and the accompanying ballot question (the โReferendum Questionโ) shall be filed with the District Clerk and with the official or agency responsible for preparing ballots for the election forthwith, and in any event no later than 70 days before the referendum, if and to the extent required by Wis. Stats. Sections 121.91(3)(a)1. and 8.37, or other applicable law. The District Clerk is directed to file copies of this Resolution and the Referendum Question with the clerk of each county having territory within the District no later than the end of the next business day after this Resolution and the Referendum Question are filed with the District Clerk.    

Referendum Election Date.  The District Clerk is hereby directed to call a referendum to be held in the District at the spring election on April 2, 2024, for the purpose of submitting to the qualified electors of the District for approval or rejection this Resolution authorizing the Districtโs budget to exceed the state revenue limits for nonrecurring purposes.  The referendum shall be conducted in accordance with Chapters 5 through 12 of the Wisconsin Statutes. Further, the District Clerk shall prepare and publish all requisite notices and provide election officials with all necessary election supplies, including ballots, if and to the extent required by Wis. Stat. Section 121.91(3)(c), or other applicable law.    

DPI Notice.  Pursuant to the provisions of Wis. Stat. Section 121.91(3)(a)1., the District Clerk shall notify the Department of Public Instruction (โDepartmentโ) of the date of the referendum and shall provide the Department with a copy of this Resolution within 10 days after the adoption of this Resolution and shall further notify the Department of the results of the referendum within 10 days following the election as prescribed by the Department.",1/29/2024 14:20
5870,Issue Debt,1039,3500,Merrill Area School District,"Tuesday, April 2, 2024"," $ 16,000,000.00 ",Kelley Strike,2245,2626,Failed,FALSE,FALSE,District wide school building and facility improvement,"BE IT RESOLVED by the School Board of the Merrill Area Common Public School District, Lincoln and Langlade Counties, Wisconsin that there shall be issued pursuant to Chapter 67 of the Wisconsin Statutes, general obligation bonds in an amount not to exceed $16,000,000 for the public purpose of paying the cost of a school facility improvement project consisting of: renovations, site and playground improvements at the Jefferson School building to accommodate the relocation of certain district programming; renovations at the High School and construction of a maintenance and operations building at the High School site; demolition of the current Northern Achievement Center, storage building, district office and maintenance building; district-wide capital maintenance, infrastructure and site improvements; and acquisition of furnishings, fixtures and equipment.",1/12/24 9:28
5889,Recurring Referendum,161,3619,Milwaukee School District,"Tuesday, April 2, 2024"," $ 252,000,000.00 ",Dean Blackwell,41589,39866,Passed,FALSE,FALSE,RESOLUTION AUTHORIZING THE SCHOOL DISTRICT BUDGET TO EXCEED REVENUE LIMIT FOR RECURRING PURPOSES,"BE IT RESOLVED by the Milwaukee Board of School Directors of the Milwaukee Public Schools, Milwaukee and Washington Counties, Wisconsin that the revenues included in the School District budget be authorized to exceed the revenue limit specified in Section 121.91, Wisconsin Statutes, by $140 million for the 2024-2025 school year; by an additional $51 million for the 2025-2026 school year; by an additional $47 million for the 2026-2027 school year; and by an additional $14 million (for a total of $252 million) for the 2027-2028 school year and thereafter, for the recurring purposes of sustaining educational programming, including offering career and technical education programs, attracting and retaining certified educators, and further improving art, music, physical education and language programs.
Adopted and recorded January 11, 2024.",1/17/24 13:36
5843,Issue Debt,103,3822,Mukwonago School District,"Tuesday, April 2, 2024"," $ 102,300,000.00 ",Thomas Karthausser,4593,5406,Failed,FALSE,FALSE,Construction of a new middle school and elementary renovations for 4k classrooms,"BE IT RESOLVED by the School Board of the Mukwonago Area School District, Waukesha and Walworth Counties, Wisconsin that there shall be issued pursuant to Chapter 67 of the Wisconsin Statutes, general obligation bonds in an amount not to exceed $102,300,000 for the public purpose of paying the cost of a school building and facility improvement project consisting of:  construction of a new middle school, including site improvements; renovations and site improvements at Big Bend Elementary School; renovations at Clarendon Avenue, Prairie View, Rolling Hills and Section Elementary Schools; demolition of the existing Park View Middle School; district-wide capital maintenance, infrastructure and site improvements; and acquisition of furnishings, fixtures and equipment.",12/20/23 15:59
5882,Issue Debt,90,3962,New Richmond School District,"Tuesday, April 2, 2024"," $ 113,700,000.00 ",Kristoffer Brown,2562,1851,Passed,FALSE,FALSE,"Shall the School District of New Richmond, St. Croix County, Wisconsin be authorized to
issue pursuant to Chapter 67 of the Wisconsin Statutes, general obligation bonds in an amount not to
exceed $113,700,000 for the public purpose of paying the cost of a school building and facility
improvement project consisting of: construction of additions and renovations at Starr and Paperjack
Elementary Schools and the Middle School; district-wide safety and capacity, building infrastructure
and site improvements; and acquisition of associated furnishings, fixtures and equipment?","Shall the School District of New Richmond, St. Croix County, Wisconsin be authorized to
issue pursuant to Chapter 67 of the Wisconsin Statutes, general obligation bonds in an amount not to
exceed $113,700,000 for the public purpose of paying the cost of a school building and facility
improvement project consisting of: construction of additions and renovations at Starr and Paperjack
Elementary Schools and the Middle School; district-wide safety and capacity, building infrastructure
and site improvements; and acquisition of associated furnishings, fixtures and equipment?",1/24/24 12:50
5896,Non-Recurring Referendum,111,3514,North Lake School District,"Tuesday, April 2, 2024"," $ 3,400,000.00 ",Jennifer Sellhausen,576,535,Passed,FALSE,FALSE,Referendum to Exceed the Revenue Limit for Four Years for Non-Recurring Purposes,"""Shall the North Lake School District, Waukesha County, Wisconsin be authorized to exceed the revenue limit specified in Section 121.91, Wisconsin Statutes, by $850,000 per year for four years, beginning with the 2024-2025 school year and ending with the 2027-2028 school year, for non-recurring purposes to sustain operational costs?""",1/19/24 15:22
5920,Issue Debt,8914,616,North Lakeland School District,"Tuesday, April 2, 2024"," $ 5,700,000.00 ",Shannon Tadiello,837,329,Passed,FALSE,FALSE,"Repair aging building systems, interiors, exteriors and improve safety and security","BE IT RESOLVED by the School Board of the North Lakeland School District, Vilas
 
 and Iron Counties, Wisconsin that there shall be issued pursuant to Chapter 67 of the Wisconsin Statutes, general obligation bonds in an amount not to exceed $5,700,000 for the public purpose of paying the cost of a school facility improvement project at the school building and site consisting of: capital maintenance and building systems improvements, including HVAC and electrical system updates; safety, security and site improvements, including for a secure main entrance; remodeling and Americans with Disabilities Act updates; and acquisition of furnishings, fixtures and equipment.",2/1/24 16:35
5919,Recurring Referendum,8914,616,North Lakeland School District,"Tuesday, April 2, 2024"," $ 550,000.00 ",Shannon Tadiello,806,257,Passed,FALSE,FALSE,To maintain current programming and educational excellence,"BE IT RESOLVED by the School Board of the North Lakeland School District, Vilas
 
 and Iron Counties, Wisconsin that the revenues included in the School District budget be
 
 authorized to exceed the revenue limit specified in Section 121.91, Wisconsin Statutes, by
 
 $550,000 beginning with the 2024-2025 school year, for recurring purposes consisting of
 
 operational expenses, including to maintain current programming.",2/1/24 16:31
5888,Non-Recurring Referendum,425,1945,Northern Ozaukee School District,"Tuesday, April 2, 2024"," $ 6,800,000.00 ",Joshua McDaniel,877,984,Failed,FALSE,FALSE,"To exceed revenue limit for non-recurring purposes consisting of operational and maintenance expenses, including to maintain current educational programs, services, and facilities.","Shall the Northern Ozaukee School District, Ozaukee County, Wisconsin be authorized to exceed the revenue limit specified in Section 121.91, Wisconsin Statutes, by $1,700,000 per year for four years, beginning with the 2024-2025 school year and ending with the 2027-2028 school year, for non-recurring purposes consisting of operational and maintenance expenses, including to maintain current educational programs, services, and facilities?",1/17/24 9:10
5851,Issue Debt,8814,4165,Osceola School District,"Tuesday, April 2, 2024"," $ 38,115,000.00 ",Shannon Grindell,1116,1245,Failed,FALSE,FALSE, Addition to the Intermediate School,"BE IT RESOLVED by the School Board of the School District of Osceola, Polk and St. Croix Counties, Wisconsin, that there shall be issued, pursuant to Chapter 67, Wisconsin Statutes, General Obligation Bonds in an amount not to exceed $38,115,000 for the purpose of paying the costs of constructing an addition to the Intermediate School to serve early childhood through fourth grade students and provide space for the Kids Klub; remodeling and updating the Intermediate and Middle School buildings and grounds; renovation or demolition of all or part of the Elementary School and site restoration; and equipment acquisition related to said projects.",1/4/24 0:00
5859,Non-Recurring Referendum,1030,4186,Osseo-Fairchild School District,"Tuesday, April 2, 2024"," $ 8,800,000.00 ",Lisa Skoyen,832,550,Passed,FALSE,FALSE,To Exceed Revenue Limit for Four Years for Non-Recurring Purposes,"Be it resolved by the School Board of the Osseo-Fairchild School District, Trempealeau, Jackson, Eau Claire and Clark Counties, Wisconsin that the revenues included in the School District budget be authorized to exceed the revenue limit specified in Section 121.91, Wisconsin Statutes, by $1,600,000 for the 2024-2025 school year, by $2,000,000 for the 2025-2026 school year, by $2,400,000 for the 2026-2027 school year and by $2,800,000 for the 2027-2028 school year, for non-recurring purposes consisting of operational, capital maintenance and facility improvement expenses",1/11/24 10:19
5921,Non-Recurring Referendum,,4207,Owen-Withee School District,"Tuesday, April 2, 2024"," $ 3,200,000.00 ",Stacy Rasmussen,333,483,Failed,FALSE,FALSE,"Exceed Revenue Cap for 4 years at $800,000 per year. ","Be it resolved b y the School Board of the School District of Owen-Withee, Clark and Taylor Counties, Wisconsin that the revenues included in the School District budget be authorized to exceed the revenue limit specified in Section 121.91, Wisconsin Statutes, by $800,000 per year beginning with the 2024-2025 school year and ending with the 2027-2028 school year, for non-recurring purposes consisting of operational and maintenance expenses. 

Adopted and recorded January 15, 2024",3/15/2024 12:56
5910,Recurring Referendum,147,4151,Parkview School District,"Tuesday, April 2, 2024"," $ 2,294,125.00 ",Tracy Case,1025,1303,Failed,FALSE,FALSE,Operational Recurring,"Shall the Parkview School District, Rock County, Wisconsin be authorized to exceed the revenue limit specified in Section 121.91, Wisconsin Statutes, by $2,294,125 beginning with the 2024-2025 school year, for recurring purposes consisting of operational and maintenance expenses, including for technology, educational programming, curriculum, salaries and benefits?",1/24/2024 12:58
5884,Issue Debt,729,4312,Pewaukee School District,"Tuesday, April 2, 2024"," $ 28,500,000.00 ",John Gahan,2391,2073,Passed,FALSE,FALSE,"Career & Technical Education High School additions & renovations, district wide capital maintenance","BE IT RESOLVED by the School Board of the School District of Pewaukee, Waukesha County, Wisconsin that there shall be issued pursuant to Chapter 67 of the Wisconsin Statutes, general obligation bonds in an amount not to exceed $28,500,000 for the public purpose of paying the cost of a school building and facility improvement project consisting of: construction of additions and renovations for the career and technical education and the relocated physical education and art program areas at Pewaukee High School; district-wide capital maintenance, building systems and solar energy improvements; other capital projects identified in the district's capital improvement plan; and acquisition of furnishings, fixtures and equipment.",1/16/24 15:03
5861,Non-Recurring Referendum,78,4389,Platteville School District,"Tuesday, April 2, 2024"," $ 10,500,000.00 ",Demetri Andrews,990,1712,Failed,FALSE,FALSE,Five-year Non-recurring operational referendum to maintain educational programs and operations of the District.,"Shall the School District of Platteville, Grant, Lafayette and Iowa Counties, Wisconsin be authorized to exceed the revenue limit specified in Section 121.91, Wisconsin Statutes, by $1,500,000 for the 2024-2025 school year, by $1,800,000 for the 2025-2026 school year, by $2,100,000 for the 2026-2027 school year, by $2,400,000 for the 2027-2028 school year and by $2,700,000 for the 2028-2029 school year, for non-recurring purposes to maintain educational programs and operations of the District?",1/11/24 10:47
5840,Issue Debt,407,4508,Port Edwards School District,"Tuesday, April 2, 2024"," $ 7,300,000.00 ",Lisa Miller,410,292,Passed,FALSE,FALSE,"$7,300,000 Capital Referendum","BE IT RESOLVED by the School Board of the School District of Port Edwards, Wood County, Wisconsin that there shall be issued pursuant to Chapter 67 of the Wisconsin Statutes, general obligation bonds in an amount not to exceed $7,300,000 for the public purpose of paying the cost of a district-wide school facility improvement project consisting of:  renovations, building infrastructure, capital maintenance and heating, ventilation and air conditioning (HVAC) improvements; safety and security upgrades; and acquisition of furnishings, fixtures and equipment.",12/20/23 12:57
5839,Non-Recurring Referendum,407,4508,Port Edwards School District,"Tuesday, April 2, 2024"," $ 4,250,000.00 ",Lisa Miller,450,254,Passed,FALSE,FALSE,"$850,000 Non-Recurring for 5 Years","BE IT RESOLVED by the School Board of the School District of Port Edwards, Wood County, Wisconsin that the revenues included in the School District budget be authorized to exceed the revenue limit specified in Section 121.91, Wisconsin Statutes, by $850,000 per year for five years beginning with the 2024-2025 school year and ending with the 2028-2029 school year, for non-recurring purposes consisting of operational and maintenance expenses.",12/20/23 12:31
5879,Recurring Referendum,8883,4529,Potosi School District,"Tuesday, April 2, 2024"," $ 700,000.00 ",Kurt Cohen,290,208,Passed,FALSE,FALSE,Exceed Revenue Limit on a Recurring Basis beginning 2024-2025,"BE IT RESOLVED by the School Board of the School District of Potosi, Grant County,
Wisconsin that the revenues included in the School District budget be authorized to exceed the revenue limit specified in Section 121.91, Wisconsin Statutes, by $400,000 for the 2024-2025 school year; by an additional $100,000 (for a total of $500,000) for the 2025-2026 school year; by an additional $100,000 (for a total of $600,000) for the 2026-2027 school year; and by an additional $100,000 (for a total of $700,000 and to remain at that amount) for the 2027-2028 school year and thereafter for recurring purposes consisting of operational expenses.",1/16/24 10:56
5908,Recurring Referendum,263,4571,Prentice School District,"Tuesday, April 2, 2024"," $ 1,800,000.00 ",Randy Bergman,421,568,Failed,FALSE,FALSE,"District Operations, student programming, facility maintenance and staff salaries and benefits","BE IT RESOLVED by the School Board of the School District of Prentice, Price, Oneida and Lincoln Counties, Wisconsin that the revenues included in the School District budget be authorized to exceed the revenue limit specified in Section 121.91, Wisconsin Statutes, by $1,800,000 beginning with the 2024-2025 school year, for recurring purposes consisting of operational and maintenance expenses, including for student programming, facility maintenance and staff salaries and benefits.",1/23/24 14:39
5892,Recurring Referendum,981,4578,Prescott School District,"Tuesday, April 2, 2024"," $ 1,200,000.00 ",Prescott Finance,986,998,Failed,FALSE,FALSE,requesting authorization to exceed the revenue limit,"Shall the School District of Prescott, Pierce County, Wisconsin be authorized to exceed the revenue limit specified in Section 121.91, Wisconsin Statutes, by $1,200,000 beginning with the 2024-2025 school year, for recurring purposes consisting of ongoing district operational costs?",1/18/24 12:50
5817,Issue Debt,8349,4781,Rhinelander School District,"Tuesday, April 2, 2024"," $ 26,000,000.00 ",Robert Thom,3637,1864,Passed,FALSE,FALSE,"Issue general obligation bonds in an amount not to exceed $26,000,000 for the public purpose of paying the cost of a school building and facility improvement project.","INITIAL RESOLUTION AUTHORIZING 
GENERAL OBLIGATION BONDS IN AN 
AMOUNT NOT TO EXCEED $26,000,000

BE IT RESOLVED by the School Board of the School District of Rhinelander, Oneida, Lincoln and Langlade Counties, Wisconsin that there shall be issued pursuant to Chapter 67 of the Wisconsin Statutes, general obligation bonds in an amount not to exceed $26,000,000 for the public purpose of paying the cost of a school building and facility improvement project consisting of:  construction of additions and renovations at Rhinelander High School, including for technical education, classrooms and labs; construction of additions, renovations, safety, security and site improvements at James Williams Middle School, including for technical education and classrooms; district-wide capital maintenance, infrastructure improvements and accessibility updates; and acquisition of furnishings, fixtures and equipment.

Adopted and recorded November 20, 2023.",11/21/23 9:52
