OriginalReferendumId,ReferendumTypeCode,PrimaryContactId,AgencyCode,AgencyName,VoteDate, Amount ,ReferendaContact,YesVotes,NoVotes,ReferendumStatusCode,IsCertificationReceived,IsDpiReviewed,BriefDescription,FullDescription,ModifiedDate
5833,Issue Debt,257,2217,Grafton School District,"Tuesday, April 2, 2024"," $ 11,140,000.00 ",Christopher Adams,2903,1938,Passed,FALSE,FALSE,"Issue General Obligation Bonds in an amount not to exceed $11,140,000 for the public purpose of paying the cost of the construction of an addition, renovations, building infrastructure and site improvements at John Long Middle School, including acquisition of furnishings, fixtures and equipment.","WHEREAS, the School Board of the School District of Grafton, Ozaukee County, Wisconsin (the ""District""), has heretofore duly adopted a resolution entitled:  ""Initial Resolution Authorizing General Obligation Bonds in an Amount Not to Exceed $11,140,000"" (the ""Initial Resolution""); and

WHEREAS, the School Board deems it to be desirable and in the best interest of the District to direct the District Clerk to submit the Initial Resolution to the electors for approval or rejection at the regularly scheduled election to be held on April 2, 2024.

NOW, THEREFORE, BE IT RESOLVED by the School Board of the District as follows:
Section 1.  Referendum Election Date.  The District Clerk is hereby directed to call a referendum election to be held in the District at the regularly scheduled election to be held on April 2, 2024 for the purpose of submitting to the qualified electors of the District the proposition of whether the Initial Resolution shall be approved.
Section 2.  Notice to Electors.  The District Clerk is directed to give notice by:
(a)	causing a Notice to Electors in substantially the form attached hereto as Exhibit A to be published in the News Graphic within ten days after the date hereof.
(b)	causing a Notice of Election in substantially the form attached hereto as Exhibit B to be published in the News Graphic in the issue published on the fourth Tuesday before the referendum election. 
(c)	causing a Notice of Referendum (which includes the facsimile of the sample ballot) in substantially the form attached hereto as Exhibit C to be published in the News Graphic in the issue published immediately preceding the referendum election.  This Notice shall also be posted in each polling place on election day.
If any of the municipalities within the District use an electronic voting system employing a ballot label and ballot card, the Notice of Referendum set forth in Exhibit C shall also include a true, actual-size copy of the ballot label and ballot card in the form in which they will appear on election day.
Section 3.  Polling Places and Hours.  The District electors must vote at the referendum election at the times and polling places at which they cast their ballots in regularly scheduled elections.
Section 4.  Referendum Election Officials.  The election officials appointed in each of the municipalities within the District shall conduct the election.
Section 5.  Official Referendum Ballot Form.  The ballot to be used at the referendum election shall be prepared in accordance with the provisions of Sections 5.64(2) and 7.08(1)(a), Wisconsin Statutes.  The ballot shall be substantially in the form attached hereto as Exhibit D.
The District Clerk shall cause to be printed sufficient ballots for use at said referendum election, both as actual ballots in those polling places which do not use voting machines and as absentee ballots where voting machines are used and as specimen ballots (the latter to be of a different and easily identifiable color from the actual ballot).  The form of the ballot shall be filed with the official responsible for providing the ballots for the election, and the District Clerk shall file a copy of the ballot with the clerk of each county having territory within the District, as soon as possible after the date hereof but in no event later than 70 days prior to the election, as provided in Section 8.37, Wisconsin Statutes.  If the District prepares the ballots, they should be delivered to the municipal clerks running the election at least 25 days prior to the election, to allow the municipal clerks to comply with their obligation to provide absentee ballots under Section 7.15, Wisconsin Statutes.
The municipal clerks of the municipalities within the District shall receive applications for absentee ballots and initial the same when issued to qualified absentee voters.
Section 6.  Canvass.  The returns of the referendum election shall be canvassed by the Board of Canvassers of each municipality within the District.  Each Board of Canvassers shall certify the returns of the referendum election to the District Clerk.  The District Clerk and two other reputable citizens appointed by the District Clerk prior to the date of the referendum election shall act as the District's Board of Canvassers for this referendum election.  This Board of Canvassers shall meet in open session no later than 9:00 a.m. on the Tuesday after the election to determine the result of the referendum election.  The canvass shall be open to the public and the District Clerk is directed to give due notice of said meeting.
Section 7.  DPI Notice.  Pursuant to the provisions of Section 120.115(1), Wisconsin Statutes, the District Clerk shall notify the Department of Public Instruction of the date of the referendum election and shall provide the Department with copies of the Initial Resolution within 10 days after the adoption of the Initial Resolution and shall further notify the Department of the results of the referendum within 10 days following the election using the method prescribed by the Department.

Adopted and recorded December 18, 2023.",12/19/23 8:56
5848,Non-Recurring Referendum,8856,2310,Green Lake School District,"Tuesday, April 2, 2024"," $ 7,400,000.00 ",Karen Werlein,485,452,Passed,FALSE,FALSE,"For non-recurring purposes consisting of operational costs to maintain instruction programs, staffing, technology and facilities.","BE IT RESOLVED by the School Board of the School District of Green Lake, Green Lake County, Wisconsin that the revenues included in the School District budget be authorized to exceed the revenue limit specified in Section 121.91, Wisconsin Statutes, by $1,400,000 for the 2024-2025 school year, by $1,800,000 for the 2025-2026 school year, by $2,000,000 for the 2026-2027 school year, and by $2,200,000 for the 2027-2028 school year, for non-recurring purposes consisting of operational costs to maintain instruction programs, staffing, technology and facilities.",1/2/24 8:09
5814,Non-Recurring Referendum,8,2296,Greendale School District,"Tuesday, April 2, 2024"," $ 12,500,000.00 ",Jonathan Mitchell,2507,1725,Passed,FALSE,FALSE,"Non-Recurring Operational Referendum for operational and maintenance expenses of $2,500,000 per year for five years.","BE IT RESOLVED by the School Board of the Greendale School District, Milwaukee
County, Wisconsin that the revenues included in the School District budget be authorized to
exceed the revenue limit specified in Section 121.91, Wisconsin Statutes, by $2,500,000 per year for five years, beginning with the 2024-2025 school year and ending with the 2028-2029 school year, for non-recurring purposes consisting of operational and maintenance expenses.",11/14/23 14:19
5917,Non-Recurring Referendum,,2394,Greenwood School District,"Tuesday, April 2, 2024"," $ 5,100,000.00 ",Joe Green,470,323,Passed,,,a 4 year operational referendum for non-recurring purposes.,"Shall the School District of Greenwood, Clark County, Wisconsin be authorized to exceed
 
 the revenue limit specified in Section 121.91, Wisconsin Statutes, by $225,000 for the 2024-2025
 
 school year, by $1,525,000 for the 2025-2026 school year, by $1,625,000 for the 2026-2027 school
 
 year and by $1,725,000 for the 2027-2028 school year, for non-recurring purposes?",1/30/2024 13:08
5876,Recurring Referendum,335,2420,Hamilton School District,"Tuesday, April 2, 2024"," $ 7,600,000.00 ",Gwendolyn Husslein,4804,4307,Passed,FALSE,FALSE,"Exceed the revenue limit specified in Section 121.91, Wisconsin Statutes, by $7,600,000 beginning with the 2024-2025 school year, for recurring purposes consisting of operational and maintenance expenses, including to maintain current class sizes, staffing levels, academic programs, course offerings and services.","BE IT RESOLVED by the School Board of the Hamilton School District, Waukesha County, Wisconsin that the revenues included in the School District budget be authorized to exceed the revenue limit specified in Section 121.91, Wisconsin Statutes, by $7,600,000 beginning with the 2024-2025 school year, for recurring purposes consisting of operational and maintenance expenses, including to maintain current class sizes, staffing levels, academic programs, course offerings and services.",1/15/24 10:04
5875,Issue Debt,335,2420,Hamilton School District,"Tuesday, April 2, 2024"," $ 25,000,000.00 ",Gwendolyn Husslein,5010,4080,Passed,FALSE,FALSE,"District-wide safety and site improvements, building updates and capital maintenance; renovations, including for technical education, science and art classrooms at Hamilton High School and construction of an addition to the cafeteria/commons area; renovations at Templeton Middle School; renovations and construction of an addition at Lannon Elementary School; and acquisition of furnishings, fixtures and equipment.","BE IT RESOLVED by the School Board of the Hamilton School District, Waukesha County, Wisconsin that there shall be issued pursuant to Chapter 67 of the Wisconsin Statutes, general obligation bonds in an amount not to exceed $25,000,000 for the public purpose of paying the cost of a school facility improvement project consisting of: district-wide safety and site improvements, building updates and capital maintenance; renovations, including for technical education, science and art classrooms at Hamilton High School and construction of an addition to the cafeteria/commons area; renovations at Templeton Middle School; renovations and construction of an addition at Lannon Elementary School; and acquisition of furnishings, fixtures and equipment.",1/15/24 10:02
5816,Issue Debt,5795,2525,Herman-Neosho-Rubicon School District,"Tuesday, April 2, 2024"," $ 23,000,000.00 ",Tony Brazouski,304,1646,Failed,FALSE,FALSE," Shall the Herman-Neosho-Rubicon School District, Dodge and Washington Counties, Wisconsin be authorized to issue pursuant to Chapter 67 of the Wisconsin Statutes, general obligation bonds in an amount not to exceed $23,000,000 for the public purpose of paying the cost of a school building and facility improvement project consisting of: construction of additions, renovations, building infrastructure and site improvements, and acquisition of furnishings, fixtures, and equipment to create a single campus at the current intermediate site?"," Shall the Herman-Neosho-Rubicon School District, Dodge and Washington Counties, Wisconsin be authorized to issue pursuant to Chapter 67 of the Wisconsin Statutes, general obligation bonds in an amount not to exceed $23,000,000 for the public purpose of paying the cost of a school building and facility improvement project consisting of: construction of additions, renovations, building infrastructure and site improvements, and acquisition of furnishings, fixtures, and equipment to create a single campus at the current intermediate site?",12/13/23 9:57
5899,Recurring Referendum,365,2527,Highland School District,"Tuesday, April 2, 2024"," $ 600,000.00 ",Linda Hebgen,315,154,Passed,FALSE,FALSE,"Exceed the revenue limit, by $600,000 beginning with
the 2024-2025 school year, for recurring purposes consisting of operational and maintenance expenses.","BE IT RESOLVED by the School Board of the Highland School District, Iowa and Grant Counties, Wisconsin that the revenues included in the School District budget be authorized to exceed the revenue limit specified in Section 121.91, Wisconsin Statutes, by $600,000 beginning with the 2024-2025 school year, for recurring purposes consisting of operational and maintenance expenses.",1/22/24 8:47
5883,Issue Debt,2639,2625,Hustisford School District,"Tuesday, April 2, 2024"," $ 5,300,000.00 ",Jessica Holtz,515,583,Failed,FALSE,FALSE,School facility improvement project consisting of MSHS Roof Replacement; HVAC maintenance and improvements at JHE & MSHS.,"BE IT RESOLVED by the School Board of the Hustisford School District, Dodge County, Wisconsin that there shall be issued pursuant to Chapter 67 of the Wisconsin Statutes, general obligation bonds in an amount not to exceed $5,300,000 for the public purpose of paying the cost of a district-wide school facility improvement project consisting of: roof replacement at the Junior/Senior High School; HVAC, capital maintenance and building infrastructure improvements and renovations at the Elementary School and Junior/Senior High School; and acquisition of related furnishings, fixtures and equipment.",1/16/24 14:16
5828,Issue Debt,136,2639,Iola-Scandinavia School District,"Tuesday, April 2, 2024"," $ 2,300,000.00 ",Sarah Thiel,826,412,Passed,FALSE,FALSE,Referendum to issue debt for school safety and building updates,"BE IT RESOLVED, by the School Board of the School District of Iola-Scandinavia, Waupaca and Portage Counties, Wisconsin that there shall be issued pursuant to Chapter 67 of the Wisconsin Statutes, general obligation bonds in an amount not to exceed $2,300,000 for the public purpose of paying the cost of a district-wide school facility improvement project consisting of: building systems, infrastructure, safety and security improvements, including remodeling for secure main entrances; and acquisition of furnishings, fixtures and equipment.",12/13/23 11:12
5855,Non-Recurring Referendum,8808,2702,Jefferson School District,"Tuesday, April 2, 2024"," $ 8,400,000.00 ",Ryan Bandt,1100,1785,Failed,FALSE,FALSE,"Exceed revenue limit by $2,100,000 a year for 4 years on a non-recurring basis for operational needs","Question: Shall the School District of Jefferson, Jefferson County, Wisconsin, be authorized to exceed the revenue limit specified in Section 121.91, Wisconsin Statutes, by $2,100,000 per year for four years, beginning with the 2024-2025 school year and ending with the 2027-2028 school year, for non-recurring purposes consisting of maintaining comprehensive instructional and co-curricular programs, student support and mental health services, safety and technology infrastructure, and sustaining salary and benefits?",1/9/24 13:39
5907,Recurring Referendum,1030,2730,Johnson Creek School District,"Tuesday, April 2, 2024"," $ 3,000,000.00 ",Mark Gruen,587,615,Failed,FALSE,FALSE,"Shall the School District of Johnson Creek, Jefferson County, Wisconsin be authorized to exceed the revenue limit specified in Section 121.91, Wisconsin Statutes, by $3,000,000 beginning with the 2024-2025 school year, for recurring purposes to maintain ongoing operational expenses, technology, safety, and educational programming?","Shall the School District of Johnson Creek, Jefferson County, Wisconsin be authorized to exceed the revenue limit specified in Section 121.91, Wisconsin Statutes, by $3,000,000 beginning with the 2024-2025 school year, for recurring purposes to maintain ongoing operational expenses, technology, safety, and educational programming?",1/23/24 14:27
5869,Recurring Referendum,8872,2737,Juda School District,"Tuesday, April 2, 2024"," $ 500,000.00 ",Traci Davis,200,233,Failed,FALSE,FALSE,"The District is seeking a $500,000 recurring operational referendum.","RESOLUTION TO EXCEED REVENUE CAP COMMENCING WITH THE 2024-25 SCHOOL YEAR

BE IT RESOLVED by the School Board of the School District of Juda, Green County, Wisconsin, that the final school district budget shall include an amount not to exceed $500,000 in excess of the revenue limits imposed by Section 121.91 of the Wisconsin Statutes each year beginning with the 2024-25 school year on a recurring basis for the purpose of paying District operating costs including, but not limited to, maintaining current staff and offering insurance for support staff and costs of capital projects including boilers, parking lot improvements, building maintenance and repairs and upgrades to the Career and Technical Education services area.",1/11/24 18:24
5853,Recurring Referendum,8863,5960,Kickapoo Area School District,"Tuesday, April 2, 2024"," $ 1,600,000.00 ",Marla Randall,370,346,Passed,FALSE,FALSE,To exceed revenue limit for recurring purposes consisting of maintain existing educational programs and services.,"BE IT RESOLVED by the School Board of the Kickapoo Area School District, Vernon, Richland and Crawford Counties, Wisconsin that the revenues included in the School District budget be authorized to exceed the revenue limit specified in Section 121.91, Wisconsin Statutes, by $400,000 for the 2024-2025 school year; by an additional $400,000 (for a total of $800,000) for the 2025-2026 school year; by an additional $400,000 (for a total of $1,200,000) for the 2026-2027 school year; and by an additional $400,000 (for a total of $1,600,000 and to remain at that amount) for the 2027-2028 school year and thereafter, for recurring purposes consisting of operational and maintenance expenses, including to maintain educational programming and services.",1/4/24 0:00
5880,Non-Recurring Referendum,7007,3862,Lake Country School District,"Tuesday, April 2, 2024"," $ 7,200,000.00 ",Melissa Schoeder,594,695,Failed,FALSE,FALSE,"Exceed the revenue limit specified in Section 121.91, Wisconsin Statutes, by $7,200,000 over 7 years for non-recurring purposes consisting of operational expenses, including but not limited to maintaining curriculum programs and services.","Exceed the revenue limit specified in Section 121.91, Wisconsin Statutes, by $450,000 for the 2024-2025 school year, $650,000 for the 2025-2026 school year, $850,000 for the 2026-2027 school year, $1,050,000 for the 2027-2028 school year, $1,20,000 for the 2028-2029 school year, $1,400,000 for the 2029-2030 school year, $1,600,000 for the 2030-2031 school year for non-recurring purposes consisting of operational expenses, including but not limited to maintaining curriculum programs and services.",1/16/24 11:01
5878,Issue Debt,7007,3862,Lake Country School District,"Tuesday, April 2, 2024"," $ 9,500,000.00 ",Melissa Schoeder,691,589,Passed,FALSE,FALSE,"General Obligation Bonds in an amount not to exceed $9,500,000 for the public purpose of paying the cost of a school building and facility improvement project consisting of: district-wide safety, security, building systems, parking lot, and technology infrastructure improvements.","General Obligation Bonds in an amount not to exceed $9,500,000 for the public purpose of paying the cost of a school building and facility improvement project consisting of: district-wide safety, security, building systems, parking lot, and technology infrastructure improvements.",1/16/24 10:55
5914,Recurring Referendum,674,2885,Lake Geneva J1 School District,"Tuesday, April 2, 2024"," $ 3,000,000.00 ",George Chironis,1896,2390,Failed,FALSE,FALSE,"$3,000,000 RR","BE IT RESOLVED by the School Board of the Lake Geneva
Joint School District No. 1, City of Lake Geneva, Towns of
Bloomfield, Geneva, LaFayette, Linn, Lyons and Spring Prairie,
Walworth County, Wisconsin that the revenues included in the
School District budget be authorized to exceed the revenue limit
specified in Section 121.91, Wisconsin Statutes, by $3,000,000
beginning with the 2024-2025 school year, for recurring purposes
consisting of ongoing operational and maintenance expenses,
infrastructure, technology and safety upgrades and for educational
programming.",1/29/2024 17:19
5915,Recurring Referendum,,2886,Lake Geneva-Genoa City Union HIgh School District,"Tuesday, April 2, 2024"," $ 3,000,000.00 ",George Chironis,2345,3101,Failed,,,"$3,000,000 RR","BE IT RESOLVED by the School Board of the Lake Geneva-Genoa City Union High School District, Walworth County, Wisconsin that the revenues included in the School District budget be authorized to exceed the revenue limit specified in Section 121.91, Wisconsin Statutes, by $3,000,000 beginning with the 2024-2025 school year, for recurring purposes consisting of ongoing operational and maintenance expenses, infrastructure, technology and safety upgrades and for education programming.",1/29/2024 17:19
5838,Non-Recurring Referendum,983,3213,Luck School District,"Tuesday, April 2, 2024"," $ 2,500,000.00 ",Heather Zacco,430,414,Passed,FALSE,FALSE,Purposes consisting of maintaining current levels of educational programming and operational costs.,"BE IT RESOLVED by the School Board of the School District of Luck, Polk County, Wisconsin that the revenues included in the School District budget be authorized to continue to exceed the revenue limit specified in Section 121.91, Wisconsin Statutes, by $500,000 per year beginning with the 2024-2025 school year and ending with the 2028-2029 school year, for non-recurring purposes consisting of maintaining current levels of educational programming and operational costs.",12/20/23 11:50
5905,Non-Recurring Referendum,455,3220,Luxemburg-Casco School District,"Tuesday, April 2, 2024"," $ 5,400,000.00 ",Rebecca Dobbe,1884,1766,Passed,FALSE,FALSE,Exceed the revenue limit for years for operational expenses,"BE IT RESOLVED by the School Board of the Luxemburg-Casco School District, Kewaunee and Brown Counties, Wisconsin that the revenues included in the School District budget be authorized to exceed the revenue limit specified in Section 121.91, Wisconsin Statutes, by $1,800,000 per year for three years, beginning with the 2024-2025 school year and ending with the 2026-2027 school year, for non-recurring purposes consisting of operational expenses including staff wages and benefits and maintaining literacy, reading, and college and technical career programming.",1/23/24 10:57
5911,Issue Debt,5722,3332,Marshall School District,"Tuesday, April 2, 2024"," $ 5,000,000.00 ",Kristin Wilkinson,648,701,Failed,FALSE,FALSE,"Seek permission to exceed the revenue limit for capital improvement projects including district-wide safe and secure school entrance improvements and Americans with Disabilities Act (ADA) accessibility updates; capital maintenance improvements, including roof and window replacements at Marshall Elementary School; a bathroom/concessions building at District athletic facilities; and acquisition of furnishings, fixtures and equipment.","BE IT RESOLVED by the School Board of the Joint School District Number 2, Village
of Marshall, Towns of Cottage Grove, Deerfield, Medina, Sun Prairie and York, Dane County,
Wisconsin that there shall be issued pursuant to Chapter 67 of the Wisconsin Statutes, general obligation bonds in an amount not to exceed $5,000,000 for the public purpose of paying the cost of a school facility improvement project consisting of: district-wide safe and secure school entrance improvements and Americans with Disabilities Act (ADA) accessibility updates; capital maintenance improvements, including roof and window replacements at Marshall Elementary School; a bathroom/concessions building at District athletic facilities; and acquisition of furnishings, fixtures and equipment.
Adopted and recorded January 22, 2024.",1/24/2024 13:10
5893,Non-Recurring Referendum,307,3360,Mauston School District,"Tuesday, April 2, 2024"," $ 9,000,000.00 ",Susan Goyette,785,1265,Failed,FALSE,FALSE,"Operational expenses, including for staff salary and benefits, to maintain class sizes and caseloads, to maintain technology and infrastructure, to maintain academic programs and to address behavior and mental health support.","BE IT RESOLVED by the School Board of the School District of Mauston, Juneau County, Wisconsin that the revenues included in the School District budget be authorized to exceed the revenue limit specified in Section 121.91, Wisconsin Statutes, by $2,250,000 per year for four years, beginning with the 2024-2025 school year and ending with the 2027-2028 school year, for non-recurring purposes consisting of operational expenses, including for staff salary and benefits, to maintain class sizes and caseloads, to maintain technology and infrastructure, to maintain academic programs and to address behavior and mental health support.",1/18/24 15:37
