OriginalReferendumId,ReferendumTypeCode,PrimaryContactId,AgencyCode,AgencyName,VoteDate, Amount ,ReferendaContact,YesVotes,NoVotes,ReferendumStatusCode,IsCertificationReceived,IsDpiReviewed,BriefDescription,FullDescription,ModifiedDate
5849,Issue Debt,598,7,Abbotsford School District,"Tuesday, April 2, 2024"," $ 17,000,000.00 ",Ashley Dake,328,241,Passed,FALSE,FALSE,Debt Referendum,"Shall the School District of Abbotsford, Clark and Marathon Counties, Wisconsin be authorized to issue pursuant to Chapter 67 of the Wisconsin Statutes, general obligation bonds in an amount not to exceed $17,000,000 for the public purpose of paying the cost of a school facility improvement project at the Middle/High School and Elementary School building consisting of:  construction of additions, including for a safe and secure entrance, classrooms and a library; renovations, including to classrooms, the technical education area and district offices; safety, security, building infrastructure, systems, parking and site improvements; technology and ADA accessibility updates; and acquisition of furnishings, fixtures and equipment?",1/2/24 10:57
5858,Issue Debt,6043,70,Algoma School District,"Tuesday, April 2, 2024"," $ 10,050,000.00 ",Jesse Brinkmann,1003,475,Passed,FALSE,FALSE,"Improvements to District buildings and grounds including safety, security and energy efficiency upgrades. Improvements to elementary school plumbing, roof and playground surface replacements. Renovating and remodeling middle/high school classrooms and support areas, restrooms, parking lot replacement, track resurfacing, window and door replacements. Renovating the Performing Arts Center audio, lighting and acoustical ceiling.","BE IT RESOLVED by the School Board of the School District of Algoma, Kewaunee County, Wisconsin, that there shall be issued, pursuant to Chapter 67, Wisconsin Statutes, General Obligation Bonds in an amount not to exceed $10,050,000 for the purpose of paying the costs of improvements to District buildings and grounds including safety, security and energy efficiency upgrades; elementary school plumbing, roof and playground surface replacements; renovating and remodeling middle/high school classrooms and support areas; middle/high school restroom remodeling and parking lot replacement; track resurfacing; window and door replacements; Performing Arts Center audio, lighting and acoustical ceiling upgrades and addressing Americans with Disabilities Act compliance issues.",1/10/24 11:42
5909,Recurring Referendum,1030,287,Barneveld School District,"Tuesday, April 2, 2024"," $ 1,000,000.00 ",Jean Flannery,576,284,Passed,FALSE,FALSE,Operating Costs and Maintenance,"BE IT RESOLVED by the School Board of the Barneveld School District, Iowa and Dane Counties, Wisconsin that the revenues included in the School District budget be authorized to exceed the revenue limit specified in Section 121.91, Wisconsin Statutes, by $1,000,000 for the 2024-2025 school year, for recurring purposes consisting of operational and maintenance expenses.",1/24/24 11:14
5887,Non-Recurring Referendum,474,413,Beloit School District,"Tuesday, April 2, 2024"," $ 27,000,000.00 ",Robert Chady,2031,2989,Failed,FALSE,FALSE,"Seeking voter authority to exceed the revenue limits by $9,000,000 per year, non-recurring, for the 2024-25, 2025-26 & 2026-27 school years for operational purposes.","BE IT RESOLVED by the School Board of the School District of Beloit, Rock County, Wisconsin that the revenues included in the School District budget be authorized to exceed the revenue limit specified in Section 121.91, Wisconsin Statutes, by $9,000,000 per year for each of the 2024-2025, 2025-2026 and 2026-2027 school years, for non-recurring purposes, consisting of operational and maintenance expenses including: staff compensation and benefits, to maintain district facilities, to maintain current course offerings, programming and class sizes, and for instructional resources and special education.",1/16/24 21:23
5845,Recurring Referendum,778,441,Birchwood School District,"Tuesday, April 2, 2024"," $ 2,600,000.00 ",Jenny Schieffer,532,262,Passed,FALSE,FALSE,Operational referendum to cover ongoing expenses.,"BE IT RESOLVED by the School Board of the School District of Birchwood that it shall include revenue in its budget for the 2025-2026 school year and thereafter a sum not to exceed $2,600,000 per school year in excess of the revenue limits set forth in Wis. Stat. ยง 121.91 for the purpose of meeting operational expenses.",12/21/23 12:11
5852,Issue Debt,8862,637,Boyceville Community School District,"Tuesday, April 2, 2024"," $ 18,000,000.00 ",Alesha Kersten,725,430,Passed,FALSE,FALSE,"Paying the cost of a school facility improvement project consisting of:  district-wide building systems, infrastructure and capital maintenance improvements; remodeling, safety, security and site improvements at the Elementary and Middle/High Schools; technology updates; improvements to the bus garage; and acquisition of furnishings, fixtures, and equipment, including school buses/vehicles.","BE IT RESOLVED by the School Board of the Boyceville Community School District, Dunn, St. Croix and Barron Counties, Wisconsin that there shall be issued pursuant to Chapter 67 of the Wisconsin Statutes, general obligation bonds in an amount not to exceed $18,000,000 for the public purpose of paying the cost of a school facility improvement project consisting of:  district-wide building systems, infrastructure and capital maintenance improvements; remodeling, safety, security and site improvements at the Elementary and Middle/High Schools; technology updates; improvements to the bus garage; and acquisition of furnishings, fixtures, and equipment, including school buses/vehicles.

Adopted and recorded January 3, 2024.",1/4/24 0:00
5866,Non-Recurring Referendum,749,657,Brighton #1 School District,"Tuesday, April 2, 2024"," $ 950,000.00 ",Melissa Grohs,277,237,Passed,FALSE,FALSE,"Operational Referendum 2024-2025 , 2025-2026 , 2026-2027","""Shall the School District Number 1, Town of Brighton, Kenosha and Racine Counties, Wisconsin be authorized to exceed the revenue limit specified in Section 121.91, Wisconsin Statutes, by $200,000 for the 2024-2025 school year, by $225,000 for the 2025-2026 school year, by $250,000 for the 2026-2027 school year and by $275,000 for the 2027-2028 school year, for non-recurring purposes consisting of operational expenses and maintaining educational programming?""",1/16/24 11:04
5901,Non-Recurring Referendum,748,665,Bristol #1 School District,"Tuesday, April 2, 2024"," $ 1,400,000.00 ",Susan Jarvis,774,784,Failed,FALSE,FALSE,"2-year non-recurring Operational Referendum to exceed the revenue limit by $700,000 per year beginning with the 2024-2025 school year and ending with the 2025-2026 school year consisting of expenses to maintain operations, facility maintenance and to update curriculum and educational programming.","BE IT RESOLVED, Shall the School District Number 1, Village of Bristol, Kenosha County, Wisconsin be authorized to exceed the revenue limit specified in Section 121.91, Wisconsin Statutes, by $700,000 per year for two years beginning with the 2024-2025 school year and ending with the 2025-2026 school year, for non-recurring purposes consisting of expenses to maintain operations, facility maintenance and to update curriculum and educational programming.",1/22/24 10:09
5871,Issue Debt,3520,700,Brodhead School District,"Tuesday, April 2, 2024"," $ 17,485,000.00 ",David Novy,892,827,Passed,FALSE,FALSE,"Resolution Authorizing General Obligation Bonds In An Amount Not To Exceed $17,485,000.","Resolution Authorizing General Obligation Bonds In An Amount Not To Exceed $17,485,000 for the public purpose of construction additions, renovations, including for secure entrances, window replacements, bathroom upgrades, capital maintenance, building infrastructure and site improvements at Albrecht Elementary and Brodhead Middle School; construction of an addition and renovations at Brodhead High School, including for a secure entrance and office; and acquisition of furnishings, fixtures and equipment.",1/12/24 11:02
5813,Recurring Referendum,344,777,Burlington Area School District,"Tuesday, February 20, 2024"," $ 11,000,000.00 ",Ruth Schenning,2724,3432,Failed,FALSE,FALSE,"Exceed revenue limit by $6,000,000 for 24-25, by an additional $3,000,000 for 25-26, by an additional $1,000,000 for 26-27, and by an additional $1,000,000 for 27-28 (for a final total of $11,000,000) for recurring purposes consisting of operational and maintenance expenses.","BE IT RESOLVED by the School Board of the Burlington Area School District, Racine, Walworth and Kenosha Counties, Wisconsin that the revenues included in the School District budget be authorized to exceed the revenue limit specified in Section 121.91, Wisconsin Statutes, by $6,000,000 for the 2024-2025 school year; by an additional $3,000,000 for the 2025-2026 school year; by an additional $1,000,000 for the 2026-2027 school year; and by an additional $1,000,000 for the 2027-2028 school year (for a final total of $11,000,000) and thereafter, for recurring purposes consisting of operational and maintenance expenses.",11/14/23 11:58
5856,Issue Debt,1030,870,Cadott Community School District,"Tuesday, April 2, 2024"," $ 25,400,000.00 ",Susan Shakal,591,1079,Failed,FALSE,FALSE,Public purpose of paying the cost of a school building and facility improvement projects,"INITIAL RESOLUTION AUTHORIZING GENERAL OBLIGATION BONDS IN AN AMOUNT NOT TO EXCEED $25,400,000

BE IT RESOLVED by the School Board of the School District of Cadott Community, Chippewa and Eau Claire Counties, Wisconsin that there shall be issued pursuant to Chapter 67 of the Wisconsin Statutes, general obligation bonds in an amount not to exceed $25,400,000 for the public purpose of paying the cost of a school building and facility improvement project consisting of: construction and/or renovations at the Junior/Senior High School, including for a secure entrance area, a gymnasium and a fitness center; construction and/or renovations for technical education and an early childhood learning center; construction of and/or improvements to athletic fields; playground updates at the Elementary School; district-wide capital maintenance, building infrastructure and site improvements; and acquisition of furnishings, fixtures and equipment.

Adopted and recorded January 8, 2024.",1/10/24 9:18
5837,Non-Recurring Referendum,8848,882,Cambria-Friesland School District,"Tuesday, April 2, 2024"," $ 7,500,000.00 ",David Dude,356,184,Passed,FALSE,FALSE,To exceed the revenue limit for non-recurring purposes  for the purpose of meeting operational expenses.,"BE IT RESOLVED by the School Board of the School District of Cambria-Friesland that it shall include revenue in its budget for the 2024-2025 school year and through the 2025-2026 and 2026-2027 school years a sum not to exceed $2,500,000 per school year in excess of the revenue limits set forth in Wis. Stat. ยง 121.91 for the purpose of meeting operational expenses. The total aggregate amount of additional authorized revenue limit authority over the three school years if the electors authorize the referendum shall be $7,500,000.",12/19/23 14:21
5872,Non-Recurring Referendum,8878,1092,Chippewa Falls Area Unified School District,"Tuesday, April 2, 2024"," $ 7,500,000.00 ",Angela Feils,4136,3633,Passed,FALSE,FALSE,"RESOLUTION AUTHORIZING THE SCHOOL DISTRICT BUDGET TO EXCEED REVENUE LIMIT BY $2,500,000 PER YEAR FOR THREE YEARS FOR NON-RECURRING PURPOSES","BE IT RESOLVED by the School Board of the Chippewa Falls Area Unified School District, Chippewa and Eau Claire Counties, Wisconsin that the revenues included in the School District budget be authorized to exceed the revenue limit specified in Section 121.91, Wisconsin Statutes, by $2,500,000 per year for three years, beginning with the 2024-2025 school year and ending with the 2026-2027 school year, for non-recurring purposes consisting of operational and maintenance expenses to maintain staffing levels, programs, services and facilities.",1/12/24 11:23
5902,Non-Recurring Referendum,1030,1246,Cuba City School District,"Tuesday, April 2, 2024"," $ 7,100,000.00 ",Heather Droessler,512,658,Failed,FALSE,FALSE,Non-recurring Referendum for 4 years,"Be it resolved by the School Board of the School District of Cuba City, Grant and Lafayette Counties, Wisconsin that the revenues included in the School District budget be authorized to exceed the revenue limit specified in Section 121.91, Wisconsin Statutes, by $1,300,000 for the 2024-2025 school year, by $1,600,000 for the 2025-2026 school year, by $1,900,000 for the 2026-2027 school year, and by $2,300,000 for the 2027-2028 school year, for non-recurring purposes consisting of operational and maintenance expenses, including to maintain current staffing levels.",1/29/2024 14:18
5818,Issue Debt,7285,1260,Cumberland School District,"Tuesday, February 20, 2024"," $ 32,950,000.00 ",Makenna Rademacher,957,696,Passed,FALSE,FALSE,"BE IT RESOLVED by the School Board of the Cumberland School District, Barron, Polk and Burnett Counties, Wisconsin that there shall be issued pursuant to Chapter 67 of the Wisconsin Statutes, general obligation bonds in an amount not to exceed $32,950,000 for the public purpose of paying the cost of a school addition and improvement project at the High School/Middle School campus to include: renovations and construction of academic spaces and support areas; partial removal of the current High School building; safety, security, technology, capital maintenance and building infrastructure improvements; ADA accessibility updates; site improvements; and acquisition of furnishings, fixtures and equipment.","BE IT RESOLVED by the School Board of the Cumberland School District, Barron, Polk and Burnett Counties, Wisconsin that there shall be issued pursuant to Chapter 67 of the Wisconsin Statutes, general obligation bonds in an amount not to exceed
$32,950,000 for the public purpose of paying the cost of a school addition and improvement project at the High School/Middle School campus to include: renovations and construction of academic spaces and support areas; partial removal of the current High School building; safety, security, technology, capital maintenance and building infrastructure improvements; ADA accessibility updates; site improvements; and acquisition of furnishings, fixtures and equipment.",11/30/23 9:17
5868,Non-Recurring Referendum,749,1414,De Pere School District,"Tuesday, April 2, 2024"," $ 23,750,000.00 ",Dawn Foeller,3773,2873,Passed,FALSE,FALSE,"Resolution authorizing the School District of De Pere Budget to exceed revenue limit by $4,750,000 per year for five years for non-recurring purposes","Be it resolved by the School Board of the Unified School District of De Pere, Brown County, Wisconsin that the revenues included in the School District budget be authorized to exceed the revenue limit specified in Section 121.91, Wisconsin Statutes, by $4,750,000 per year for five years, beginning with the 2024-2025 school year and ending with the 2028-2029 school year, for non-recurring purposes consisting of operational and maintenance expenses.",1/29/2024 13:02
5904,Non-Recurring Referendum,330,1421,De Soto Area School District,"Tuesday, April 2, 2024"," $ 4,800,000.00 ",Cherryl Knowles,493,1027,Failed,FALSE,FALSE,"Non-recurring $1,200,000 per year for 2024-25 through 2027-2028 for maintaining education and operational services.","Shall the De Soto Area School District, Vernon and Crawford Counties, Wisconsin be authorized to exceed the revenue limit specified in Section 121.91, Wisconsin Statutes, for non-recurring purposes by $1,200,000 per year for maintaining educational and operational services, for the 2024-2025 school year through the 2027-2028 school year?",1/22/24 13:19
5863,Issue Debt,8875,1491,Drummond Area School District,"Tuesday, April 2, 2024"," $ 29,980,000.00 ",Melissa Dahl,908,752,Passed,FALSE,FALSE,"CTE/Tech Ed addition and remodel.
HVAC and electrical system upgrade and replacement.
Exterior building envelope repair and site repair to prevent flooding.
Remodel areas throughout the building to update the educational spaces and comply with Americans with Disabilities Act (ADA) -- restrooms included.
Creation of a secure entrance to control visitor access.
Furniture, fixtures and equipment.","BE IT RESOLVED by the School Board of the Drummond Area School District, Bayfield and Douglas Counties, Wisconsin that there shall be issued pursuant to Chapter 67 of the Wisconsin Statutes, general obligation bonds in an amount not to exceed $29,980,000 for the public purpose of paying the cost of a school building and facility improvement project at the school building and site consisting of: construction of additions for career and technical education and a safe and secure entrance area; renovations, capital maintenance, building infrastructure, systems and site improvements; classroom updates, including science lab upgrades; and acquisition of furnishings, fixtures and equipment.",1/11/24 11:03
5862,Non-Recurring Referendum,8875,1491,Drummond Area School District,"Tuesday, April 2, 2024"," $ 4,800,000.00 ",Melissa Dahl,1004,662,Passed,FALSE,FALSE,"Current programs and services for students.
18 students:1 teacher ratio, especially at the elementary levels.
Course offerings (such as career & tech ed, agriculture, fine arts, Spanish, and more).","BE IT RESOLVED by the School Board of the Drummond Area School District, Bayfield and Douglas Counties, Wisconsin that the revenues included in the School District budget be authorized to exceed the revenue limit specified in Section 121.91, Wisconsin Statutes, by $1,200,000 per year for four years, beginning with the 2024-2025 school year and ending with the 2027-2028 school year, for non-recurring purposes consisting of operational expenses, including to maintain current programs and services for students.",1/11/24 10:59
5864,Recurring Referendum,446,1568,Edgerton School District,"Tuesday, April 2, 2024"," $ 3,500,000.00 ",Stefanie Johnson,1967,1356,Passed,FALSE,FALSE,"RESOLUTION AUTHORIZING THE SCHOOL
DISTRICT BUDGET TO EXCEED REVENUE LIMIT
BY $3,500,000 FOR RECURRING PURPOSES
","In the event a majority of the electors voting on the question vote ""yes"", the District will be authorized to exceed the revenue limit specified in Section 121.91, Wisconsin Statutes, by $3,500,000 beginning with the 2024-2025 school year, for recurring purposes consisting of operational and maintenance expenses.",1/11/24 15:11
5881,Non-Recurring Referendum,8789,1631,Elkhart Lake-Glenbeulah School District,"Tuesday, April 2, 2024"," $ 7,000,000.00 ",Adam Englebretson,672,485,Passed,FALSE,FALSE,"4-year, $7,000,000 for non-recurring purposes consisting of operational and general maintenance expenses","Shall the School Board of the School District of Elkhart Lake-Glenbeulah, Sheboygan County, Wisconsin be authorized to exceed the revenue limit specified in Section 121.91, Wisconsin Statutes, by $1,750,000 per year for four years, beginning with the 2024-2025 school year and ending with the 2027-2028 school year, for non-recurring purposes consisting of operational and general maintenance expenses?",1/16/24 13:26
5854,Issue Debt,7248,1659,Ellsworth Community School District,"Tuesday, April 2, 2024"," $ 25,445,000.00 ",Ashley Halverson,1463,1341,Passed,FALSE,FALSE,"School facility improvement projects at the Middle and High Schools consisting of: construction of additions and renovations, including for physical education, fitness, career and technical education spaces: capital maintenance, building infrastructure, systems and site improvements: and acquisition of furnishings, fixtures and equipment.","BE IT RESOLVED by the School Board of the Ellsworth Community School District, Pierce County, Wisconsin that there shall be issued pursuant to Chapter 67 of the Wisconsin Statutes, general obligation bonds in an amount not to exceed $25,445,000 for the public purpose of paying the cost of a school facility improvement project at the Middle and High Schools consisting of: construction of additions and renovations, including for physical education, fitness, career and technical education spaces: capital maintenance, building infrastructure, systems and site improvements: and acquisition of furnishings, fixtures and equipment.",1/9/24 10:30
5890,Non-Recurring Referendum,6188,1694,Evansville Community School District,"Tuesday, April 2, 2024"," $ 22,300,000.00 ",Tom Parsons,1431,1504,Failed,FALSE,FALSE,"Five year referendum for non-recurring purposes consisting of operational and maintenance expenses, including to maintain current class sizes, to provide student resources, to maintain educational programming, sa l aries, and benefits, and to address facility maintenance","Question: Shall the Evansville Community School District, Rock, Green and Dane Counties, Wisconsin be authorized to exceed the revenue limit specified in Section 121.91, Wisconsin Statutes, by $2,700,000 for the 2024-2025 school year, by $3,900,000 for the 2025-2026 school year, by $4,600,000 for the 2026-
2027 school year, by $5,200,000 for the 2027-2028 school year, and by $5,900,000 for the 2028-2029
school year, for non-recurring purposes consisting of operational and maintenance expenses, including to maintain current class sizes, to provide student resources, to maintain educational programming, sa l aries, and benefits, and to address facility maintenance?",1/17/24 19:04
5903,Issue Debt,8885,1813,Fennimore Community School District,"Tuesday, April 2, 2024"," $ 17,000,000.00 ",Jane Wonderling,669,348,Passed,FALSE,FALSE,"Paying the cost of a school facility improvement project consisting of: district-wide capital maintenance, ADA accessibility updates and renovations, building systems, technology and site improvements; construction of an addition for career and technical education and renovations at the Middle/High School; lighting updates to the athletic fields; and acquisition of furnishings, fixtures and equipment.","BE IT RESOLVED by the School Board of the Fennimore Community School District, Grant County, Wisconsin that there shall be issued pursuant to Chapter 67 of the Wisconsin Statutes, general obligation bonds in an amount not to exceed $17,000,000 for the public purpose of paying the cost of a school facility improvement project consisting of: district-wide capital maintenance, ADA accessibility updates and renovations, building systems, technology and site improvements; construction of an addition for career and technical education and renovations at the Middle/High School; lighting updates to the athletic fields; and acquisition of furnishings, fixtures and equipment.",1/22/24 11:49
5877,Non-Recurring Referendum,660,1883,Fort Atkinson School District,"Tuesday, April 2, 2024"," $ 19,500,000.00 ",Nathan Knitt,2363,2284,Passed,FALSE,FALSE,"Non-recurring referendum for $6,500,000 per year for 3 years (FY25-27)","BE IT RESOLVED by the School Board of the School District of Fort Atkinson, Jefferson and Rock Counties, Wisconsin, that the final school district budget beginning with the 2024-25 school year shall include an amount not to exceed $6,500,000 each year on a non-recurring basis for a period of three years through the 2026-27 school year in excess of the revenue limits imposed by Section 121.91 of the Wisconsin Statutes for the purpose of paying District operating costs.",1/16/24 9:30
5894,Non-Recurring Referendum,8879,1939,Frederic School District,"Tuesday, April 2, 2024"," $ 4,280,000.00 ",Joshua Robinson,437,547,Failed,FALSE,FALSE,"Exceed the revenue limit by an amount not to exceed $1,070,000 on a non-recurring basis for four years beginning with the 2024-25 school year for operational expenses, staffing and maintenance costs.","BE IT RESOLVED by the School Board of the Frederic School District, Polk and Burnett Counties, Wisconsin, that, in order to sustain resources supporting student learning, the final school district budget shall include an amount not to exceed $1,070,000 in excess of the revenue limits imposed by Section 121.91 of the Wisconsin Statutes on a non-recurring basis for a period of four years beginning with the 2024-25 school year and ending with the 2027-28 school year for the purpose of paying District operation, staffing and maintenance costs.",1/19/24 10:57
5886,Issue Debt,451,1953,Freedom Area School District,"Tuesday, April 2, 2024"," $ 62,500,000.00 ",Maggie Gagnon,1910,1225,Passed,FALSE,FALSE,Additions and renovations to current Middle-High School.,"Be it resolved by the School Board of the Freedom Area School District, Outagamie County, Wisconsin that there shall be issued pursuant to Chapter 67 of the Wisconsin Statutes, general obligation bonds in an amount not to exceed $62,500,000 for the public purpose of paying the cost of a school building and facility improvement project consisting of: construction of additions and/or renovations at the Middle-High School, including for technical education, music education, classrooms/labs, safety improvements, a cafeteria/kitchen and a fitness center; construction of a greenhouse for agriculture education; district-wide capital maintenance and site improvements; and acquisition of furnishing, fixtures and equipment.",1/16/24 17:30
